{
  "constraints": [],
  "display_name": "自由落体",
  "generalization_factors": [
    {
      "category": "object_composition",
      "name": "ball_material",
      "source": "appearance.ball_material"
    },
    {
      "category": "environment",
      "name": "background",
      "source": "appearance.background"
    }
  ],
  "metric_spec": {
    "common_sense_checks": [
      "downward acceleration",
      "no upward launch",
      "object identity preserved"
    ],
    "prediction_quantities": [
      "vertical trajectory",
      "impact time",
      "acceleration"
    ],
    "prediction_subjects": [
      "falling_ball"
    ],
    "visual_attributes": [
      "ball material",
      "motion blur",
      "background consistency"
    ]
  },
  "non_conditionable_physics_parameters": [],
  "scene_id": "free_fall",
  "schema_version": "2.0",
  "structured_physics_parameters": [
    "ball_mass",
    "ball_radius",
    "initial_height",
    "initial_velocity"
  ]
}
